ref,address,eircode,date_entered,valuation
"DS40/103","15 Humbert Street, Ballina, Co Mayo","","2019-10-16","80000"
"DS2024/17","Lidl House, Bohernasup, Ballina, Co Mayo F26 X5P9","F26 X5P9","2024-10-07","90000"
"DS40/108","""Stephanie's Hair Salon"", Abbey Street, Abbeyhalfquarter, Ardnaree South, Ballina, Co Mayo F26XT63","F26 XT63","2019-10-16","40000"
"DS40/110","53 Lord Edward Street, Ballina, Co Mayo","","2019-11-29","29000"
"DS40/114","26 Roche's Terrace, Ballina, Co Mayo","","2019-11-29","29000"
"DS40/115","36 Lord Edward Street, Ballina, Co Mayo","","2019-10-30","27000"
"DS40/116","3 Tyrawley Terrace, Ballina, Co Mayo","","2019-10-31","33500"
"DS40/118","22 Tyrawley Terrace, Ballina, Co Mayo F26 C8Y6","F26 C8Y6","2019-11-29","125000"
"DS40/119","43 Tyrawley Terrace, Ballina, Co Mayo","","2019-10-30","25000"
"DS40/121","Lower Bunree Road, Ballina, Co Mayo","","2019-10-18","25000"
"DS40/122","Lower Bunree Road, Ballina, Co Mayo","","2019-10-18","25000"
"DS40/123","Bunree Road, Ballina, Co Mayo","","2019-10-30","25000"
"DS40/126","Abbey Street, Abbeyhalfquater, Ardnaree South, Ballina, F26 R6D2","F26 R6D2","2019-10-24","62000"
"DS40/128","2 Nally Street, Ballina, Co Mayo","","2019-10-24","70000"
"DS40/131","4 Ferran Terrace, Ballina, Co Mayo","","2019-10-24","45000"
"DS40/132","12 Tyrawley Terrace, Ballina, Co Mayo","","2019-11-29","125000"
"DS40/133","27 Roche's Terrace, Ballina, Co Mayo","","2020-02-06","26000"
"DS40/141","""Pinocchio's"", O'Rahilly Street, Ballina, Co Mayo","","2019-11-04","60000"
"DS40/142","James Connolly Street, Ballina, Co MayoF26 VPP3","","2019-11-04","56500"
"DS40/143","27 Corcoran's Terrace, Ballina, Co Mayo F26 W889","F26 W889","2019-11-19","80000"
"DS40/145","""Manse"", Walsh Street, Ballina, Co Mayo","","2019-10-30","60000"
"DS40/150","12 Convent Terrace, McDermott Street, Ballina, Co Mayo F26 R2Y1","F26 R2Y1","2019-11-07","100000"
"DS40/157","McDermott Street, Ballina, Co Mayo","","2020-02-07","50000"
"DS40/159","Lord Edward Street, Ballina, Co Mayo F26 EP30.","F26 EP30","2020-07-17","70000"
"DS40/160","Becket' s Saw Mill, Barret Street, Ballina, Co Mayo","","2020-03-04","100000"
"DS40/164","The Brook, Ballina, Co Mayo F26 H9K8","F26 H9K8","2020-03-04","50000"
"DS40/165","The Brook, Ballina, Co Mayo F26 F6P6","F26 F6P6","2020-03-04","50000"
"DS40/166","The Brook, Ballina, Co Mayo F26 H9K8","F26 H9K8","2020-04-20","170000"
"DS40/174","20 Healy Terrace, Ballina, Co Mayo","","2020-09-03","100000"
"DS40/175","16 Healy Terrace, Ballina, Co Mayo","","2020-01-06","10000"
"DS40/180","Clare Street, Ballina, Co Mayo","","2020-09-03","50000"
"DS40/184","Un-Used Land, Castlefield Manor, Kilmoremoy, Ballina, Co Mayo","","2023-10-05","90000"
"DS40/187","Arbuckle Row, Ballina, Co Mayo F26 V1F2.","F26 V1F2","2023-12-20","150000"
"DS40/188","68 Lord Edward Street, Ballina, Co Mayo F26 K104.","F26 K104","2024-01-17","70000"
"DS40/190","8 St. Enda's Villas, Ballina, Co Mayo","","2024-09-17","50000"
"DS40/191","No. (9) St. Enda's Villa's Ballina, Co Mayo F26 Y9P0.","F26 Y9P0","2024-03-13","75000"
"DS40/195","Property 1 Barrett Street, Ballina, Co Mayo F26 C3W2","F26 C3W2","2024-03-13","60000"
"DS40/196","Property 100 Barrett Street, Ballina, Co Mayo F26 C3W2, adjoining, (Old Forge Building)","F26 C3W2","2024-03-13","40000"
"DS40/200","No. 26 James Connolly Street, Ballina, Co Mayo F26 E4F5.","F26 E4F5","2024-04-18","80000"
"DS40/194","38 Ferran Terrace, Ballina, Co Mayo F26 K7W1","F26 K7W1","2024-01-17","90000"
"DS40/41","4 Tyrawley Terrace, Ballina","","2019-02-25","100000"
"DS40/49","Teeling Street, Ballina, Co Mayo","","2019-06-27","40000"
"DS40/57","O'Rahilly Street, Ballina, F26 K803 (Garveys Bakery)","F26 K803","2019-07-11","80000"
"DS40/68","Old Mill, Bunree Road, Ballina","","2011-11-08","200000"
"DS40/72","10 Tyrawley Terrace, Ballina, Co Mayo","","2011-11-10","28000"
"DS40/76","Entrance to ""The Hawthorns"", Killala Road, Ballina","","2011-11-14","30000"
"DS40/83","Old Mill,Knocknalyre, Sligo Road, Ballina","","2014-11-24","70000"
"DS40/87","88 Lord Edward Street, Ballina, Co Mayo","","2019-10-31","32000"
"DS40/90","McDermott Street, Ballina, Co Mayo","","2024-05-09","80000"
"DS40/91","""Pet Stop Discount Warehouse"", Kevin Barry St., Ballina,Co Mayo F26 A073","F26 A073","2019-08-01","23000"
"DS40/94","""Diamond Memorials"", Teeling St., Ballina","","2019-08-01","80000"
"DS40/98","2 St. Muredach's Terrace, Ballina","","2019-07-04","60000"
"DS40/99","12 St. Muredach's Terrace, Ballina F26 NY56","F26 NY56","2025-09-10",""
"DS2024/03","6 Rath Glas, Rehinsfort, Ballina, Co Mayo F26 DTR2","F26 DTR2","2024-06-05","180000"
"DS2024/04","Killala Road, Ballina, Co Mayo F26 DTR2","F26 DTR2","2024-07-02","250000"
"DS2024/06","Foxford Road, Ballina, Co Mayo F26 K4D&","","2024-07-02","100000"
"DS2024/12","15 James Connolly Street, Ballina, Co Mayo F26 A2Y1","F26 A2Y1","2025-09-09","75000"
"DS2024/23","Tyrawley House, McDermott Street, Ballina, Co Mayo F26 R5P3","F26 R5P3","2025-01-08",""
"DS2024/28","14 James Connolly Street, Ballina, Co Mayo F26 T8N4","F26 T8N4","2025-05-07","70000"
"DS2025/01","47 Tyrawley Terrace, Ballina, Co Mayo F26 HF96","F26 HF96","2025-03-05",""
"DS2025/02","No. 8 Convent Hill Grove, Ballina, Co Mayo F26 X9N9","F26 X9N9","2025-03-07",""
"DS2025/03","2 Oaklawn, Killala Road, Ballina, F26 P6P2","F26 P6P2","2025-03-07",""
"DS2025/04","3 Oaklawn, Killala Road, Ballina, F26 D6C7","F26 D6C7","2025-03-07",""
"DS2025/05","26 Mount Assumpta, Ballina, F26 D4R2","F26 D4R2","2025-03-07",""
"DS2026/23","The Brook, Abbeyhalfquarter, Ballina, Co Mayo","","2026-02-20",""
"DS2026/22","Plunkett Road, Ballina, Co Mayo","","2026-02-20",""
"DS2026/21","5 Plunkett Road, Ballina, Co Mayo F26 P7X3","F26 P7X3","2026-02-20",""
"DS01/20","Main Street, Ballycastle, Co Mayo","","2020-09-03","40000"
"DS01/23","Main Street, Ballycastle, Co Mayo","","2020-02-06","50000"
"DS16/14","Church Street, Crossmolina","","1991-07-12","27000"
"DS16/29","Kilmurrymore, Rake St., Crossmolina, Co Mayo","","2022-01-20","40000"
"DS16/31","""Corcoran's"", Ballina Street, Crossmolina, Co Mayo","","2021-04-15","40000"
"DS16/38","Erris Street, Crossmolina, Co Mayo","","2019-10-23","25000"
"DS16/39","Erris Street, Crossmolina, Co Mayo","","2019-10-23","50000"
"DS16/40","""Boys National School"", Chapel Street, Crossmolina","","2019-12-11","100000"
"DS16/43","Church Street, Crossmolina, Co Mayo F26NY86","F26 NY86","2019-10-24","50000"
"DS16/45","Ballina Street, Crossmolina, Co Mayo","","2020-02-05","40000"
"DS10/13(b)","George Street, Killala, Co Mayo","","1991-07-15","10000"
"DS10/37","Georges Street, Killala, Co Mayo","","2019-10-24","80000"
"DS10/38","Market Street, Killala, Co Mayo","","2020-09-03","35000"
"DS10/41","Market Street, Killala, Co Mayo","","2019-10-24","40000"
"DS10/42","Market Street, Killala, Co Mayo","","2019-10-24","30000"
"DS10/43","Market Street, Killala, Co Mayo","","2019-10-24","35000"
"DS10/45","""Warehouse/Grainstore"", Courthosue Street, Killala, Co Mayo","","2019-10-24","50000"
"DS10/46","Market Street, Killala, Co Mayo","","2019-10-31","40000"
"DS10/47","The Acres, Killala, Co Mayo","","2019-10-23","20000"
"DS10/48","Barrack Street, Killala, Co Mayo F26 NW64","F26 NW64","2019-12-11","50000"
"DS10/50","Church Street, Killala, Co Mayo","","2019-10-23","50000"
"DS10/52","R314, Gore Street, Killala, Co Mayo F26 CR94","F26 CR94","2024-03-13","70000"
"DS2024/16","43 Woodview Court, Killala, Co Mayo F26 FV32","F26 FV32","2024-10-15","70000"
"DS2024/18","George's Street, Killala, Co Mayo","","2025-01-08",""
"DS30/01","Steelaun, Rathfran, Carrowmore Lacken, Ballina, Co Mayo","","2022-09-01","150000"
"DS42/03","""Woodside Motors"", Claremorris Road, Balla, Co Mayo","","2020-02-05","80000"
"DS42/04","Main Street, Balla, Co Mayo","","2020-02-05","40000"
"DS42/06","Main Street, Balla, Co Mayo F23 H429","F23 H429","2020-02-05","100000"
"DS42/08","Main Street, Balla, Co Mayo F23 YH30","F23 YH30","2021-09-21","140000"
"DS2024/19","Semi-detached structure adjacent to former Garda Station, Ballyglass, Claremorris, Co Mayo","","2025-01-08",""
"DS43/01","""Ballyvary House"", Main Street, Ballyvary, Castlebar, Co Mayo F23 CH64","F23 CH64","2020-02-17","70000"
"DS39/03","""Heneghan's"", Belcarra, Castlebar, Co Mayo","","2020-02-17","160000"
"DS2025/32","Belcarra, Castlebar, Co Mayo F23 YY93","F23 YY93","2025-08-27",""
"DS2025/33","Belcarra, Castlebar, Co Mayo F23 KN72","F23 KN72","2025-08-27",""
"DS41/01","Ellison Street, Castlebar","","2015-01-05","200000"
"DS41/02","Newport Rd., Castlebar","","2017-01-30","50000"
"DS41/03","Newport Rd., Castlebar","","2017-01-30","50000"
"DS41/14","Lower Charles Street, Castlebar","","2016-01-21","45000"
"DS41/17","Saleen Property Site 2F","","2019-06-28","140000"
"DS41/18","Quinns, Mountain View, Co Mayo","","2019-04-09","150000"
"DS41/21","Gavin and Brennan Buildings, Knockthomas, Castlebar, Co Mayo F23 YW65","F23 YW65","2020-02-17","300000"
"DS41/23","Site H: Brennan's Yard, Knockthomas, Castlebar, Co Mayo","","2020-02-28","200000"
"DS41/24","Former Commercial Premises, Newport Road, Castlebar, Co Mayo F23E297","F23 E297","2021-11-04","60000"
"DS41/30","5B Garryduff Drive, Castlebar, Co Mayo F23 K258","F23 K258","2020-02-07","115000"
"DS41/32","Hanley's Shop, Rock Square, Castlebar, Co Mayo","","2021-01-21","140000"
"DS41/34","Davitt's Terrace, Castlebar, Co Mayo F23 PW30","F23 PW30","2020-02-17","80000"
"DS41/37","6 Ellison Street, Castlebar, Co Mayo F23 NH56","F23 NH56","2020-02-28","100000"
"DS41/40","""Ellison Street House"", Ellison Street, Castlebar, Co Mayo F23 HY10","F23 HY10","2020-02-28","300000"
"DS41/41","""Terraced House"", Tucker Street, Castlebar, Co Mayo","","2020-09-03","80000"
"DS41/42","""Unfinished House"", Station Road, Castlebar, Co Mayo","","2020-08-28","50000"
"DS41/44","50 McCormack Estate, Castlebar, Co Mayo F23 WK63","F23 WK63","2020-08-28","23000"
"DS41/45","Saleen Site (beside Cushlough), Saleen, Castlebar, Co Mayo","","2021-01-21","150000"
"DS41/48","Timlin House, Newport Road, Castlebar, Co Mayo","","2021-11-16","180000"
"DS41/53","5 Kennedy Gardens, Castlebar, Co Mayo F23 EH58","F23 EH58","2024-10-21",""
"DS2024/30","88 Springfield Court, Castlebar, Co Mayo F23 C567","F23 C567","2025-04-30",""
"DS2024/31","89 Springfield Court, Castlebar, Co Mayo F23 E863","F23 E863","2025-05-01",""
"DS2025/09","30 Riverdale Court, Castlebar, Co Mayo F23 EH51","F23 EH51","2025-05-06",""
"DS2025/10","3 Riverdale Court, Castlebar, Co Mayo F23 XR60","F23 XR60","2025-07-16","125000"
"DS2025/16","Hill House, Mountain View, Castlebar, Co Mayo, F23 WE16","F23 WE16","",""
"DS2025/48","79 Curragh, Castlebar, Co Mayo F23 HK53","F23 HK53","2025-12-15",""
"DS2025/51","12 Belvedere Court, Newtown, Castlebar, Co Mayo F23 CX29","F23 CX29","2025-12-15",""
"DS2025/63","Ashton, Spencer Park, Castlebar, Co Mayo F23 E261","F23 E261","2025-12-15",""
"DS2025/71","80 McHale Road, Castlebar, Co Mayo F23 WY46","F23 WY46","2028-02-20",""
"DS2025/27","Devanney's Bar, Lahardane, Co Mayo F26 CK77","F26 CK77","2025-07-18",""
"DS2025/66","Lahardane, Ballina, Co Mayo F26 P5X5","F26 P5X5","2025-12-15",""
"DS25/02","27 Ard Lugalisheen, Ballindine, Co Mayo","","2022-04-19","160000"
"DS25/03","26 Ard Lugalisheen, Ballindine, Co Mayo","","2022-04-19","130000"
"DS25/04","25 Ard Lugalisheen, Ballindine, Co Mayo","","2022-04-19","130000"
"DS25/05","24 Ard Lugalisheen, Ballindine, Co Mayo","","2022-04-19","130000"
"DS2025/28","4 Ard Lugalisheen, Ballindine, Co Mayo F12 K660","F12 K660","2025-06-26",""
"DS17/08","High Street, Ballinrobe, Co Mayo","","2016-03-16","40000"
"DS17/09","High Street, Ballinrobe, Co Mayo","","2016-03-16","40000"
"DS17/10","High Street, Ballinrobe, Co Mayo","","2016-03-16","50000"
"DS17/38","Old Rugby Club, High St., Ballinrobe, Co Mayo","","2016-01-21","60000"
"DS17/46","Cornmarket, Ballinrobe, Co Mayo","","2011-10-18","70000"
"DS17/47","Bridge Street, Ballinrobe, Co Mayo","","2011-05-16","50000"
"DS17/48","Bridge Street, Ballinrobe, Co Mayo","","2011-08-05","50000"
"DS17/50","Glebe Street, Ballinrobe, Co Mayo F31 E767","F31 E767","2011-08-18","40000"
"DS17/52","Glebe Street, Ballinrobe, Co Mayo ""Farraghers Shop""","","2011-10-18","100000"
"DS17/54","""Old Garage"", Castlebar Road, Ballinrobe, Co Mayo","","2021-09-21","60000"
"DS17/56","Creagh Road, Ballinrobe, Co Mayo","","2011-10-07","60000"
"DS17/60","Bridge Street, Ballinrobe, Co Mayo","","2019-12-11","50000"
"DS17/65","""Mooneys"", Bridge Street, Ballinrobe, Co Mayo F31 AK54","F31 AK54","2021-11-09","150000"
"DS17/67","Lough Mask Road, Ballinrobe, Co Mayo F31 FK53","F31 FK53","2022-07-22","150000"
"DS17/71","Convent Road, Ballinrobe, Co Mayo","","2022-10-06","40000002000000"
"DS17/77","Bowgate Street, Ballinrobe, Co Mayo F31 H322","F31 H322","2023-03-07","150000"
"DS2025/13","88 New Street, Ballinrobe, Co Mayo F31 X337","F31 X337","2025-06-24",""
"DS2025/26","Cloonnagashel, Ballinrobe, Co Mayo F31 KX73","F31 KX73","2025-06-24",""
"DS2025/14","87 New Street, Ballinrobe, Co Mayo","","2025-06-30","100000"
"DS2025/25","Glenview, 49 Abbey Street, Ballinrobe, Co Mayo F31 T671","F31 T671","2025-06-30",""
"DS2025/24","54 Abbey Street, Ballinrobe, Co Mayo F31 Y192","F31 Y192","2025-06-30",""
"DS2025/23","Abbey Street, Ballinrobe, Co Mayo F31 A466","F31 A466","2025-06-30",""
"DS2025/56","11 Hazel Court, Convent Road, Ballinrobe, Co Mayo F31 YK83","F31 YK83","2025-12-03",""
"DS2025/57","Apartment Buildings & Shop Units at Hazel Court, Convent Road, Ballinrobe, Co Mayo F31 K461","F31 K461","2025-12-22",""
"DS2025/58","Apartment Buildings & Shop Units at Hazel Court, Convent Road, Ballinrobe, Co Mayo F31 XF34","F31 XF34","2025-12-22",""
"DS2025/59","Apartment Buildings & Shop Units at Hazel Court, Convent Road, Ballinrobe, Co Mayo F31 R981","F31 R981","2025-12-22",""
"DS2025/60","Apartment Buildings & Shop Units at Hazel Court, Convent Road, Ballinrobe, Co Mayo F31 H562","F31 H562","2025-12-22",""
"DS2025/61","Apartment Buildings & Shop Units at Hazel Court, Convent Road, Ballinrobe, Co Mayo F31 T025","F31 T025","2025-12-22",""
"DS2025/62","Apartment Buildings & Shop Units at Hazel Court, Convent Road, Ballinrobe, Co Mayo F31 AN81","F31 AN81","2025-12-22",""
"DS18/13","Barrack Street, Ballyhaunis, Co Mayo","","2021-11-16","60000157812000047022"
"DS18/14","Barrack Street, Ballyhaunis, Co Mayo","","2019-06-28","20000"
"DS18/26","Clare Road, Ballyhaunis, Co Mayo","","2018-10-30","25000"
"DS18/50","""Dillon's"", Main Street & Knox Stret, Ballyhaunis, Co Mayo F25XP63","F25 XP63","2021-11-09","70000"
"DS18/53","Abbeyquarter, Ballyhaunis, Co Mayo","","2012-04-02","120000"
"DS18/54","Knock Rd., Ballyhaunis, Co Mayo","","2019-06-28","70000"
"DS18/61","Old Larganboy School, Larganboy East, Co Mayo","","2019-10-16","60000"
"DS18/62","Bridge Street, Ballyhaunis, Co Mayo F35 FP20","F35 FP20","2019-07-08","40000"
"DS18/65","""McCabe House"", Abbey Street, Ballyhaunis, Co Mayo","","2020-01-15","40000"
"DS18/67","Old Shed/Garage, Carrownluggan, Ballyhaunis, Co Mayo","","2020-04-03","80000"
"DS18/71","Abbeyquarter, Ballyhaunis, Co Mayo","","2020-04-14","120000"
"DS2025/08","37 Barley Hill Court, Bohola, Co Mayo F12 NN88","F12 NN88","2025-03-14",""
"DS20/04","Ballagh Street - Dwelling House, Charlestown, Co Mayo","","2020-07-08","160000"
"DS20/06","Mark C. Henry Lane - Dwelling House, Charlestown, Co Mayo","","2020-07-17","50000"
"DS20/07","Market Square, Charlestown, Co Mayo","","2020-07-17","70000"
"DS20/09","Chapel Street, Charlestown, Co Mayo","","2020-07-17","120000"
"DS20/12","JF Mechanical Engineering, Lowpark, Charlestown, Co Mayo F12 K235","F12 K235","2020-07-17","200000"
"DS20/13","Ballagh Street, Charlestown, Co Mayo F12 KN66","F12 KN66","2022-05-05","70000"
"DS19/32","James Street, Claremorris, Co Mayo","","2011-05-11","235000"
"DS19/33","Adjacent to Town Hall, Claremorris, Co Mayo","","2011-08-18","125000"
"DS19/36","26 Clareville, Claremorris, Co Mayo F12E821","F12 E821","2023-02-22","80000"
"DS19/37","27 Clareville, Claremorris, Co Mayo","","2023-02-22","60000"
"DS19/40","Mount Street, Claremorris, Co Mayo F12D2E4","F12 D2E4","2019-10-10","70000"
"DS19/42","Cash For Clothes, The Square, Claremorris, Co Mayo","","2019-10-16","70000"
"DS19/43","O Brien Flats Knock Road Claremorris Co Mayo F12Y1T9, F12Y314","F12 Y1T9","2019-10-10","100000"
"DS19/46","61 Lisnaboley, Claremorris, Co Mayo","","2020-02-28","80000"
"DS19/51","Mount Street, Claremorris, Co Mayo","","2019-10-31","60000"
"DS19/59","Town Hall Road, Claremorris, Co Mayo","","2019-12-11","5000"
"DS19/60","James Street, Claremorris, Co Mayo","","2019-10-31","235000"
"DS19/63","James Street, Claremorris, Co Mayo (beside bank on corner F12 VF95).","F12 VF95","2019-12-11","50000"
"DS19/65","Dalton Street, Claremorris, Co Mayo","","2020-07-08","14000"
"DS19/66","Convent Road, Claremorris, Co Mayo F12 T8K1","F12 T8K1","2020-07-08","100000"
"DS19/72","15 Lui Na Greine, Claremorris, Co Mayo F12 D2F5","F12 D2F5","2022-09-01","130000"
"DS19/73","Old Convent, Claremount, Claremorris, Co Mayo F12WP03","F12 WP03","2024-02-12","250000"
"DS19/75","Mount Street, Claremorris, Co Mayo F12 N8N8","F12 N8N8","2023-05-17","80000"
"DS2025/22","16 Ard Rua, Claremorris, Co Mayo F12 P6K5","F12 P6K5","2025-06-23",""
"DS2025/43","43 Lisnaboley, Claremorris, Co Mayo F12 TK35","F12 TK35","2026-02-20",""
"DS2025/44","37 Grattan Manor, Grattan Park, Claremorris, Co Mayo F12 R7P3","F12 R7P3","2025-11-26","190000"
"DS2026/06","James Street, Claremorris, Co Mayo F12 R7F7","F12 R7F7","2026-02-20",""
"DS2026/04","Mount Street, Claremorris, Co Mayo F12 EH61","F12 EH61","2026-02-20",""
"DS2026/02","Convent Road, Claremorris, Co Mayo F12 RY61","F12 RY61","2026-02-20",""
"DS23/01","Main Street, Cong, Co Mayo F31 H585","F31 H585","2021-09-28","150000"
"DS02/01","Dispensary Road, Foxford, Co Mayo","","2023-03-23","60000"
"DS02/04","Davitt St, Foxford, Co Mayo F26 DY61","F26 DY61","2023-03-23","100000"
"DS2024/21","House without a roof, Irishtown, Foxford, Co Mayo","","2025-01-08",""
"DS2024/26","Derelict Estate, Barrack Road, Foxford, Co Mayo","","2026-03-05",""
"DS2024/22","Irishtown, Foxford, Co Mayo F26 EY90","F26 EY90","2025-01-08",""
"DS2025/17","63 Assumpta Place, Foxford, Co Mayo F26 FN51","F26 FN51","2025-05-06",""
"DS04/07","Old Petrol Station, N17, Kilkelly, Co Mayo","","2019-12-11","40000"
"DS04/08","Bridge Street. Kilkelly, Co Mayo F35 V840","F35 V840","2020-10-08","70000"
"DS04/14","High Street, Kilkelly, Co Mayo F35 AP92","F35 AP92","2020-10-06","100000"
"DS04/16","Ballaghaderreen Road, Kilkelly, Co Mayo","","2020-10-06","100000"
"DS2025/18","29 Highland Park, Kilkelly, Co Mayo F35 AK25","F35 AK25","2025-05-19",""
"DS2025/21","32 Highland Park, Kilkelly, Co Mayo F35 KW27","F35 KW27","2025-05-19","70000"
"DS2025/20","31 Highland Park, Kilkelly, Co Mayo F35 HP40","F35 HP40","2025-05-19",""
"DS2025/19","30 Highland Park, Kilkelly, Co Mayo F35 AX89","F35 AX89","2025-05-19",""
"DS12/34","Thomas Street, Kiltimagh, Co Mayo","","2009-07-10","80000"
"DS12/47","""Raftery Room"", Main Street, Kiltimagh, Co Mayo","","2020-02-06","60000"
"DS12/51","Ballinamore, Kiltimagh, Co Mayo F12RK72","F12 RK72","2021-04-15","70000"
"DS12/52","Former Commercial Unit, Main Street, Kiltimagh, Co Mayo F12EK84.","F12 EK84","2024-09-19","60000"
"DS12/56","A. Cleary & Sons Limited, George's Street, Kiltimagh, Co Mayo","","2024-09-19","50000"
"DS2024/20","Former N17 Night-Club, Main Street, Kiltimagh, Co Mayo F12 ND32","F12 ND32","2025-01-08",""
"DS2025/35","James Street, Kiltimagh, Co Mayo F12 KV00","F12 KV00","2025-08-27",""
"DS06/01","Belmont Hotel, Churchfield, Knock, Co Mayo F12 XF64","F12 XF64","2020-11-18","390000"
"DS06/01(a)","Churchfield, Knock, Co Mayo","","2017-03-14","150000"
"DS06/08","Cloondace, Knock, Co Mayo","","2021-01-21","70000"
"DS06/09","Carrowmore, Knock, Co Mayo F12 DV58","F12 DV58","2021-01-21","235000"
"DS31/01","Roundfort Stores, Roundfort, Hollymount, Co Mayo F12 R2E1","F12 R2E1","2023-02-17","300000"
"DS05/06","Main St., Shrule, Co Mayo","","2012-03-12","60000"
"DS15/25","Old Dwelling House, Pound Lane, Swinford, Co Mayo F12 R1X9","F12 R1X9","2020-01-10","80000"
"DS15/34","Chapel Street, Swinford, Co Mayo","","2023-05-17","60000"
"DS15/35","Station Road, Swinford, Co Mayo F 12 D8660","","",""
"DS15/36","St. Ita's Terrace, Swinford, Co Mayo","","2018-10-30","40000"
"DS15/37","Brookville Ave. Swinford, Co Mayo","","2018-10-30","40000"
"DS15/38","Brookville Ave. Swinford, Co Mayo","","2018-10-30","40000"
"DS15/47","Pound Lane, Swinford, Co Mayo","","2018-11-29","60000"
"DS15/48","Pound Lane, Swinford, Co Mayo","","2018-11-29","60000"
"DS15/49","Bridge Street, Brookville Avenue, Swinford, Co Mayo","","2023-03-23","60000"
"DS15/50","Brookville Avenue, Swinford, Co Mayo","","2023-03-23","30000"
"DS15/51","Brookville Avenue, Swinford, Co Mayo","","2023-03-23","40000"
"DS15/54","Davitt Place, Swinford, Co Mayo F12 VY82","F12 VY82","2023-03-23","60000"
"DS15/55","Station Road, Swinford, Co Mayo F 12 D8660","","2023-03-23","80000"
"DS15/57","Main Street, Swinford, Co Mayo F12 TY79.","F12 TY79","2024-07-16","85000"
"DS15/58","Main Street, Swinford, Co Mayo F12 D1R8","F12 D1R8","2023-05-17","70000"
"DS15/59","Main Street, Swinford, Co Mayo F12 R298","F12 R298","2023-05-17","80000"
"DS15/60","No. 3 Chapel Row, Swinford, Co Mayo F12 P522.","F12 P522","2023-12-19","100000"
"DS15/61","No (12) Gleann Darach, Swinford, Co Mayo F12 K318","F12 K318","2023-12-19","120000"
"DS15/62","No (13) Gleann Darach, Swinford, Co Mayo F12 WF64.","F12 WF64","2024-03-13","120000"
"DS15/63","No (14) Gleann Darach, Swinford, Co Mayo F12X722","F12 X722","2024-03-13","150000"
"DS2024/14","Ballina Road, Swinford, Co Mayo F12 T289","F12 T289","2025-01-08",""
"DS2025/15","Rathscanlan, Swinford, Co Mayo F12 D925","F12 D925","2025-05-06",""
"DS2025/36","Carrowneden (House 1), Killasser, Swinford, Co Mayo","","2025-12-08",""
"DS2025/37","Carrowneden (House 2), Killasser, Swinford, Co Mayo","","2025-12-08",""
"DS30/01(a)","Kilmaine Road, The Neale, Ballinrobe, Co Mayo","","2022-11-22","40000"
"DS09/53","Pollagh, Keel, Achill, Co Mayo","","2021-04-15","40000"
"DS09/54","Pollagh, Keel, Achill, Co Mayo F28 NX43","F28 NX43","2020-08-28","40000"
"DS09/59","Keel West, Dooagh, Achill, Co Mayo","","2020-08-28","40000"
"DS09/61","Keel West, Dooagh, Achill, Co Mayo F28 TW10","F28 TW10","2020-08-28","30000"
"DS09/63","Achill Sound, Co Mayo F28 N922","F28 N922","2020-09-03","40000"
"DS09/64","Achill Sound, Co Mayo F28 E8C2","F28 E8C2","2020-09-03","70000"
"DS09/66","Polranny, Achill Sound, Co Mayo","","2020-10-08","160000"
"DS09/67","""The Railway Hostel"", Polranny, Achill Sound, Westport, Co Mayo F28 W6DO","F28 W6DO","2020-10-08","200000"
"DS09/68","Polranny, Achill Sound, Co Mayo F28 F102","F28 F102","2022-01-20","100000"
"DS09/72","Polranny, Achill Sound, Co Mayo","","2020-10-08","140000"
"DS09/82","Slievemore, Dooagh, Achill, Co Mayo F28 VW13","F28 VW13","2021-01-21","50000"
"DS09/85","Pollagh, Keel, Achill. Co Mayo","","2020-10-08","50000"
"DS09/86","Dooniver, Achill, Co Mayo","","2022-09-01","50000"
"DS24/01","The Old Terminal Building, Achill Sound","","1991-09-17","160000"
"DS2026/14","Bangor Erris, Ballina, Co Mayo F26 F9T3","F26 F9T3","2026-03-03",""
"DS13/40","Main Street, Belmullet, Co Mayo","","2020-01-06","90000"
"DS13/41","Tallagh, Belmullet, Co Mayo F26 CC82","F26 CC82","2020-01-15","90000"
"DS13/42","Chapel Street, Belmullet, Co Mayo F26 XK23","F26 XK23","2020-01-15","100000"
"DS2026/16","An Eachléim, An Fód Dubh, Béal an Átha, Contae Maigh Eo (Teach 1)","","2026-03-03",""
"DS2026/17","An Eachléim, An Fód Dubh, Béal an Átha, Contae Maigh Eo (Teach 2)","","2026-03-03",""
"DS2026/18","An Eachléim, An Fód Dubh, Béal an Átha, Contae Maigh Eo (Teach 3)","","2026-03-03",""
"DS2026/19","An Eachléim, An Fód Dubh, Béal an Átha, Contae Maigh Eo (Teach 4)","","2026-03-05",""
"DS2026/20","An Eachléim, An Fód Dubh, Béal an Átha, Contae Maigh Eo (Suíomh)","","2026-03-03",""
"DS13/44","Quay Street, Belmullet, Co Mayo","","2020-01-15","40000"
"DS13/50","""Tallagh House"", Tallagh, Belmullet, Co Mayo","","2021-04-15","50000"
"DS2025/70","8 Shráid na Beairice, Íochtarach, Béal an Mhuirthead, Co Mhaigh Eo F26 PQ23","F26 PQ23","2026-02-20",""
"DS2025/69","Shráid na Beairice, Íochtarach, Béal an Mhuirthead, Co Mhaigh Eo F26 P272","F26 P272","2026-02-20",""
"DS2025/68","Na Harda, Béal an Mhuirthead, Co Maigh Eo","","2026-02-20",""
"DS07/02","Tooreen, Louisburgh, Co Mayo","","2021-01-14","50000"
"DS07/03","Long Street, Louisburgh, Co Mayo F28 Y567","F28 Y567","2020-01-15","140000"
"DS07/04","Long Street, Louisburgh, Co Mayo F28 N660","F28 N660","2020-01-15","150000"
"DS08/30","Joyce's Garage, Medlicott Street, Newport, Co Mayo","","2019-12-11","100000"
"DS08/32","""Carrowbaun House"", Medlicott Street, Newport, Co Mayo F28 PD62","F28 PD62","2021-01-14","160000"
"DS08/34","Main Street, Newport, Co Mayo F28 P266","F28 P266","2019-12-11","100000"
"DS08/37","Quay Road, Newport, Co Mayo Townland of KnocknageehaF28 FX04","","2019-12-11","80000"
"DS08/43","George's Street, Newport, Co Mayo","","2019-12-11","40000"
"DS08/52","Newport Youth Café, Castlebar Street, Newport, Co Mayo F28 HF79","F28 HF79","2021-01-14","120000"
"DS08/56","Quay Road, Newport, Co Mayo","","2022-09-01","120000"
"DS10/01","Fairgreens Lower, Westport,F28 ND68","F28 ND68","2019-08-01","175000"
"DS10/04","North Mall, Westport, Co Mayo F28 A898","F28 A898","2020-03-04","250000"
"DS10/07","Quay Road Lower, Westport, Co Mayo","","2019-10-30","1400000"
"DS10/12","Quay Road Lower, Westport, F28 Y096","F28 Y096","2019-09-24","185000"
"DS10/13(a)","Quay Road Lower, Westport, Co .Mayo, F28 V963","F28 V963","2021-04-15","170000"
"DS10/20","High Street, Westport, Co Mayo F28 HW66","F28 HW66","2025-04-15",""
"DS10/21","James Street, Westport, Co Mayo F28 NV00","F28 NV00","2024-10-17","130000"
"DS10/24","Altamount Street, Westport, Co Mayo F28 H292.","F28 H292","2024-09-16","100000"
